<?xml version="1.0" encoding="UTF-8"?>
<market:presentation xmlns:xsi="http://www.w3.org/2001/XMLSchema-instance"
	xmlns:market="http://www.market.com/access" xsi:schemaLocation="http://www.market.com/access access.xsd">
	<page-view>
		<role>GUEST</role>
		<home-page>main</home-page>
		<page-categories>
			<page-category>
				<page-category-key>main</page-category-key>
				<page-category-path>/controller/main</page-category-path>
			</page-category>
			<page-category>
				<page-category-key>clothes</page-category-key>
				<page-category-path>/controller/clothes</page-category-path>
			</page-category>
			<page-category>
				<page-category-key>cart</page-category-key>
				<page-category-path>/controller/cart</page-category-path>
			</page-category>
		</page-categories>
	</page-view>
	<page-view>
		<role>CLIENT</role>
		<home-page>main</home-page>
		<page-categories>
			<page-category>
				<page-category-key>main</page-category-key>
				<page-category-path>/controller/main</page-category-path>
			</page-category>
			<page-category>
				<page-category-key>clothes</page-category-key>
				<page-category-path>/controller/clothes</page-category-path>
			</page-category>
			<page-category>
				<page-category-key>cart</page-category-key>
				<page-category-path>/controller/cart</page-category-path>
			</page-category>
			<page-category>
				<page-category-key>orders</page-category-key>
				<page-category-path>/controller/orders</page-category-path>
			</page-category>
		</page-categories>
	</page-view>
	<page-view>
		<role>ADMIN</role>
		<home-page>clothes</home-page>
		<page-categories>
			<page-category>
				<page-category-key>clothes</page-category-key>
				<page-category-path>/controller/clothes</page-category-path>
			</page-category>
			<page-category>
				<page-category-key>users</page-category-key>
				<page-category-path>/controller/users</page-category-path>
			</page-category>
			<page-category>
				<page-category-key>orders</page-category-key>
				<page-category-path>/controller/orders</page-category-path>
			</page-category>
		</page-categories>
	</page-view>
</market:presentation>